{
  "id": "2026-09-05-extra64",
  "slot": "tarde",
  "pillar": "cita",
  "core": {
    "subject": "Rumi y la caña que abre el Masnavi",
    "hook": "\"Escucha esta caña cómo se queja: cuenta historias de separaciones.\"",
    "body": [
      "Es el verso 1 del Libro I del Masnavi, la obra mayor de Yalal ad-Din Rumi. Abre una serie de dieciocho versos sobre una flauta de caña arrancada del cañaveral, que llora porque fue cortada. Reynold A. Nicholson estableció el texto persa a partir de los manuscritos más antiguos disponibles —el primero de ellos copiado en Konya en 1278, cinco años después de la muerte del poeta— y publicó edición crítica, traducción y comentario en ocho volúmenes entre 1925 y 1940. Sigue siendo el texto de referencia.",
      "Esa precisión hace falta por un motivo concreto. Rumi es hoy uno de los poetas más citados del planeta y buena parte de lo que circula con su nombre no está en sus libros. Ibrahim Gamard, que trabaja sobre el persa original, ha documentado poemas populares que no aparecen en los manuscritos más antiguos y otros donde el intermediario inglés añadió imágenes que el texto no tiene. Un artículo de 2024 en Delos, revista de traducción de la Universidad de Florida, señala que las versiones más difundidas despojan a los versos de su contexto islámico y de sus raíces persas.",
      "El verso auténtico promete menos y pesa más. No habla de unión: nombra una separación, y sostiene que el lamento de la caña cortada es exactamente lo que la vuelve música. Ochocientos años después, lo que más se comparte con la firma de Rumi suele ser lo que Rumi no escribió."
    ],
    "question": "¿De quién es, en realidad, la frase que más repites?",
    "quote": {
      "text": "Escucha esta caña cómo se queja: cuenta historias de separaciones.",
      "author": "Yalal ad-Din Rumi",
      "work": "Masnavi, Libro I, verso 1 (ed. crítica de R. A. Nicholson, 1925-1940)",
      "attribution_verified": true
    }
  },
  "card": {
    "renderer": "quote_card",
    "variant": "gold"
  },
  "sources": [
    {
      "claim": "El verso citado es Mathnawi I:1. Nicholson lo traduce \"Listen to the reed how it tells a tale, complaining of separations\". El persa transliterado es \"be-sh'naw în nay chûn shikâyat mê-kon-ad / az jodâ'îy-hâ hikâyat mê-kon-ad\" (literalmente: escucha esta caña cómo se queja / cuenta historias de separaciones). La traducción al español de esta pieza se hizo sobre esos dos hemistiquios.",
      "source": "Ibrahim Gamard, \"The Song of the Reed (part one)\", Dar al-Masnavi of the Mevlevi Order: traducción, notas y transliteración basadas en la traducción de Nicholson de 1926, revisada contra el manuscrito más antiguo de Konya",
      "url": "https://dar-al-masnavi.org/n-I-0001.html"
    },
    {
      "claim": "Reynold A. Nicholson editó los tres primeros volúmenes como edición crítica de los manuscritos más antiguos del Masnavi; el conjunto son ocho volúmenes de la E. J. W. Gibb Memorial Series, con edición, traducción y comentario, publicados entre 1925 y 1940. La edición se hizo a partir de los manuscritos más antiguos disponibles, el primero de ellos de 1278, conservado en el museo Mevlana de Konya.",
      "source": "E. J. W. Gibb Memorial Trust, ficha de The Mathnawí of Jaláluʾddín Rúmí, volumen 1 (texto persa), editado por Reynold A. Nicholson; y reseña de la edición en el Bulletin of the School of Oriental and African Studies (Cambridge)",
      "url": "https://www.gibbtrust.org/the-mathnawi-of-julaluddin-rumi-volume-1-persian-text/"
    },
    {
      "claim": "Varias de las citas de Rumi más difundidas no son auténticas o están tergiversadas: \"Not Christian or Jew or Muslim...\" no es un poema auténtico y falta en los manuscritos más antiguos; \"Come again, please, come again, whoever you are...\" no está autenticado como suyo y aparece en obras de poetas anteriores; en \"Let the beauty we love be what we do. There are hundreds of ways to kneel and kiss the ground\" la primera línea es de Barks y el original no menciona besar ni el suelo; y \"Out beyond ideas of wrongdoing and rightdoing...\" presenta como relativismo moral lo que en el original es trascendencia mística de los límites mentales.",
      "source": "Ibrahim Gamard, \"Corrections of Popular Versions of Poems From Rumi's Divan\", Dar al-Masnavi",
      "url": "https://www.dar-al-masnavi.org/corrections_popular.html"
    },
    {
      "claim": "Las traducciones de Coleman Barks \"a menudo despojan a los versos de Rumi de su contexto islámico y de sus raíces culturales persas\", con \"tendencia a omitir o alterar referencias religiosas, remodelando así la intención de Rumi\".",
      "source": "Abeer Piracha (University of Texas, Dallas), \"Orientalizing the East: The West's Misrepresentation of Rumi's Poetry\", Delos: A Journal of Translation and World Literature, University of Florida Press, 2024 (resumen público; el texto completo es de pago)",
      "url": "https://journals.upress.ufl.edu/delos/article/view/2337"
    },
    {
      "claim": "Coleman Barks llamó \"versiones\" a sus textos desde el principio y ha aclarado que no sabe persa y que trabaja a partir de traducciones literales hechas por otros; sin embargo, las cubiertas y portadas de sus libros los anuncian como \"Translations by Coleman Barks\".",
      "source": "The Tempest, \"Here's why that Rumi quote you're posting is actually fake\"; coincidente con la crítica documentada en Dar al-Masnavi",
      "url": "https://thetempest.co/2020/05/23/entertainment/translations-rumis-poetry-question-reliability-of-narrator/"
    }
  ],
  "do_not_use": [
    "\"Ni cristiano, ni judío, ni musulmán...\". Circula por todas partes como poema de Rumi y Gamard lo documenta como no auténtico: falta en los manuscritos persas más antiguos.",
    "\"Más allá de las ideas del bien y del mal hay un campo; allí nos encontraremos\", en la versión de Coleman Barks. Gamard señala que la versión inglesa convierte en relativismo moral lo que en el original es trascendencia mística de los límites de la mente. No usarla como lema de tolerancia.",
    "\"Vuelve, vuelve, quienquiera que seas...\". No está autenticado como de Rumi y se encuentra en obras de poetas anteriores a él.",
    "\"Que la belleza que amamos sea lo que hacemos. Hay cientos de maneras de arrodillarse y besar el suelo\". La primera línea es de Barks, no de Rumi, y el original no habla de besar ni de suelo.",
    "Citar a Rumi sin libro y sin verso. El Masnavi está numerado por libro y verso en la edición de Nicholson; una cita sin esa referencia no se puede comprobar, y en esta página no se publica.",
    "Llamar \"traducciones\" a las versiones de Barks sin matiz. Él mismo las llamó versiones y ha dicho que no lee persa: trabaja sobre traducciones literales de terceros. La palabra correcta importa porque es donde se cuela lo que Rumi no escribió.",
    "Fechar la composición del Masnavi con un año concreto. Las fuentes consultadas no lo dan. Lo que sí está fechado es el manuscrito más antiguo conocido, copiado en Konya en 1278, y la edición crítica de Nicholson, de 1925 a 1940.",
    "Presentar la caña como imagen de consuelo o de plenitud. En el arranque del Masnavi la caña canta porque la cortaron: la queja por la separación es la condición del canto, no un obstáculo que se supere."
  ],
  "targets": [
    "facebook",
    "instagram",
    "threads"
  ],
  "status": "ready",
  "results": {},
  "publish_at": "2026-09-06T00:33:00Z"
}
